{
    "division": "GROWERS",
    "ordered_at": "2015-08-03T02:55:00Z",
    "order_num": "GROW0000001",
    "salesperson": "gbush",
    "source_code": "WEB",
    "order_type": "WEB",
    "customer_notes": null,
    "store_notes": null,
    "ip_address": "168.33.11.134",
    "shipping_amount": 799,
    "shipping_local_tax_amount": 50,
    "shipping_county_tax_amount": 8,
    "shipping_state_tax_amount": 8,
    "shipments": [ ],
    "payments": [
        {
            "payment_method": "stripe",
            "amount": 865,
            "transaction_code": "ch_6kWpby7JOucf1O",
            "currency": "USD"
        }
    ]
}
